PartID,StoryTopicID,TextID,StoryTitle,Order,StoryText
2P,1,SP2P101,Cookies at Sunset,1,"Anna arrived at the small yellow house on Maple Street without knowing a single neighbor. The moving truck pulled away just as the sun dipped low, leaving her in a quiet space filled with unopened boxes. During those first days, she worked from home, sending emails and brewing tea in solitude."
2P,1,SP2P102,Cookies at Sunset,2,"From her kitchen window, Anna often spotted an elderly man in the next yard. He wore a wide straw hat and tended his garden with patient, deliberate movements. His watering can glimmered in the light, and whenever he noticed her watching, he lifted a gentle hand to greet her before resuming his work."
2P,1,SP2P103,Cookies at Sunset,3,"The neighborhood remained mostly silent until one morning when Anna’s internet suddenly stopped working. Irritated and unsure who to contact, she stepped outside, hoping to find someone who knew the local providers. Standing near the gate, she hesitated, scanning the empty street for help or even a familiar face."
2P,1,SP2P104,Cookies at Sunset,4,"George, the gardener next door, noticed her uncertainty and slowly approached. “You must be the new neighbor,” he said with a warm smile. He introduced himself, explaining that he had lived on Maple Street for forty years. They spoke about the area—its quiet charm, weather patterns, and a café he recommended nearby."
2P,1,SP2P105,Cookies at Sunset,5,"Before they parted, George handed Anna a small paper bag. “My wife made too many cookies again,” he said with a soft laugh, insisting she take them. The simple gesture felt unexpectedly comforting. Anna thanked him, surprised by how easily the conversation had eased the loneliness of her first days."
2P,1,SP2P106,Cookies at Sunset,6,"That evening, Anna sat by her kitchen window, tasting one of the cookies while watching the garden lights flicker gently across George’s yard. The warmth of the treat and the soft glow outside settled into her heart. For the first time since moving in, the yellow house truly felt like home."
2P,2,SP2P201,The Empty Market,1,"Every Sunday morning, Alex wandered through the farmer’s market with his old film camera. He wasn’t a professional photographer. He was just someone who loved capturing small, overlooked moments. He admired how sunlight glowed across fruit stands and how children’s laughter drifted between stalls. Over time, vendors recognized him and greeted him with playful poses."
2P,2,SP2P202,The Empty Market,2,"This Sunday carried a different feeling. The air was cool, carrying the warm scent of cinnamon bread from a nearby stall. Alex lifted his camera and captured an elderly couple sharing coffee, a young boy chasing pigeons, and a street musician quietly tuning his guitar. Each moment felt gentle, fleeting, and worth saving."
2P,2,SP2P203,The Empty Market,3,"He lingered near the center of the market, waiting patiently for the perfect light. Adjusting his lens again and again, he studied the shifting brightness across faces and fruits. A small girl tugged at her mother’s sleeve, whispering, “That man takes happy pictures.” Alex overheard her and flushed, touched by the innocent remark."
2P,2,SP2P204,The Empty Market,4,"As the morning deepened, the sun slipped behind the tall church tower, washing the market in a soft golden glow. Alex took one last wide shot, pleased by how everything shimmered under the fading light. He packed his camera carefully, waved to familiar vendors, and stepped away as the crowd continued bustling around him."
2P,2,SP2P205,The Empty Market,5,"At home, he settled into his darkroom, comforted by the familiar routine. He gently fed the film into the reel, lowered it into the developing tank, and waited as the images slowly emerged. Developing film always felt like watching memories appear out of nothing, each frame a small doorway back into the day."
2P,2,SP2P206,The Empty Market,6,"But when the images cleared, Alex froze. Every single frame was empty—no vendors, no children, no laughing girl, no golden market. Each shot held only still stalls, silent streets, and his own faint reflection in the glass. The cheerful morning he remembered existed nowhere but in his mind."
2P,3,SP2P301,The Red Scarf,1,"Mia rushed through the crowded train station with her suitcase thumping against her leg as she moved. She had overslept again, and the announcement for her departing train echoed through the vast hall. The air smelled of roasted coffee and damp concrete, and her breath formed pale clouds as she hurried forward."
2P,3,SP2P302,The Red Scarf,2,"Reaching the far end of the platform, she finally slowed and noticed a red scarf resting on a bench. It appeared handmade with soft wool and slightly uneven stitches, the kind that carried warmth and intention. She paused to look around, wondering if its owner might still be nearby searching for it."
2P,3,SP2P303,The Red Scarf,3,"No one seemed to be looking for anything. Mia hesitated with the scarf in her hands for a moment, considering whether she might keep it. Her own neck felt icy in the morning air. After a brief reflection, she decided it did not belong to her and gently placed it in a visible spot."
2P,3,SP2P304,The Red Scarf,4,"The whistle of her train cut through the noise of the station, urging her to move. Mia jogged toward the waiting doors, weaving through other passengers who shuffled and bumped past. She felt the usual rush of last minute travel rising, pushing her toward the car before the doors slid shut."
2P,3,SP2P305,The Red Scarf,5,"As the train began to roll forward, Mia glanced back toward the platform. A young woman had reached the bench and now held the red scarf tightly against her chest. She looked relieved, almost glowing with gratitude. The expression was soft but unmistakable, a moment of quiet joy reclaimed from potential loss."
2P,3,SP2P306,The Red Scarf,6,"Mia settled into her seat, heart warming in the cool interior of the train. She smiled to herself as the station drifted out of sight. The morning had been rushed and chaotic, yet she found comfort in knowing she had brightened a stranger’s day with a simple act of kindness."