StudyPartID,StoryTopicID,Predictability,PredictID,TextID,SP2ConID,StoryTitle,Order,StoryText
2,T4P0,No,0,SP2T4P002,0,The Museum,2,"Alan hesitated for a moment before pushing open the door to the doll room. The air inside was noticeably cooler, as though the temperature had dropped only within that space. He flicked on the brighter overhead lights, letting them wash over rows of dolls dressed in old-fashioned clothing—lace bonnets, frilled dresses, sailor suits. But everything was perfectly still. No doll was out of place. No case was open. No object had fallen. Determined to convince himself he was simply tired, he stepped back into the hallway and continued his routine patrol. The creak of the old wooden floorboards beneath his shoes grounded him somewhat, pulling him back to the more practical concerns of the night. When he reached the staircase leading to the first floor, he released a slow breath, relieved to be out of that unsettling room. As he descended, a sudden knocking echoed through the entrance hall below. It was firm and rhythmic, the kind of knock someone would make when they expected an immediate response. Alan hurried toward the door, thinking Lina had finally arrived. The thought eased him; at least he wouldn’t be alone with the strange noises. He unlocked the heavy front door and pulled it open, bracing himself for Lina’s apology for being late. But instead of Lina, a small boy was standing outside the door."
2,T4P0,No,0,SP2T4P003,0,The Museum,3,"Alan blinked in surprise at the sight of the child, who looked no older than seven. The boy stood shivering slightly in the cool night air, his hands tucked into the pockets of a thin jacket that wasn’t warm enough for the weather. Alan crouched down to the boy’s height and asked gently where his parents were. The boy lifted his eyes—dark, wide, and strangely calm—and said he had been walking with his mother before the two of them became separated near the museum. Hearing this, Alan’s concern deepened. He guided the child inside and seated him on a wooden bench in the lobby, offering reassurance that help would come soon. Then he made the necessary call to the police, reporting the situation clearly and requesting immediate assistance. The boy sat silently during the call, staring ahead with an expression that was difficult to read. Alan checked the time—five minutes had already passed. Every minute felt longer than the last as he waited for the officers. Suddenly, another round of knocking sounded at the door. This time the knocks were lighter, quicker, more familiar. Thinking the police had arrived earlier than expected, Alan hurried back to the entrance and opened it. But this time, it was Lina."
2,T4P0,No,0,SP2T4P004,0,The Museum,4,"Lina stepped in, brushing the cold from her sleeves and apologizing breathlessly for her delay. But once her eyes landed on the boy, she stopped mid-sentence. Something about him unsettled her, though she couldn’t explain why. Meanwhile, the boy wandered slowly around the lobby, studying the exhibits behind glass as though he were seeing them for the first time. He paused in front of an old taxidermy bird, then turned to the two adults and asked in a whisper whether the museum’s objects came alive at night. Alan forced a laugh, claiming that nothing in the museum ever moved on its own. But Lina didn’t laugh. Instead, she gently pulled Alan aside, lowering her voice. She unlocked her phone and showed him a breaking news report: a young boy had been hit by a speeding car minutes earlier at the exact intersection beside the museum. The article included a blurry image of the accident scene along with a brief statement that the child had been rushed away before witnesses could provide details. "
2,T4P0,No,0,SP2T4P005,0,The Museum,5,"A cold knot formed in Alan’s stomach as the situation became harder and harder to rationalize. The boy’s calmness, the strange timing, and Lina’s unease all pressed together into a discomfort he couldn’t shake. Yet before he could ask Lina more questions, the loud clacking of footsteps echoed from outside, followed by firm knocks on the museum door. Alan felt instant relief—finally, the police had arrived. Two officers stepped into the building, shining their flashlights briefly around the lobby. They spoke gently to the boy, confirmed his name, and assured him that they would help him find his mother. The child followed obediently, not speaking a word as they guided him toward the door. Before leaving, one of the officers turned to Alan and asked a routine question: “Are you the only staff member here tonight?” Alan blinked, confused, and immediately pointed to Lina standing right beside him. The officer frowned, scanning the empty air where Alan had gestured. His eyes moved back to Alan with a puzzled expression, repeating the question as though he hadn’t heard the first answer. The officer said he could only see Alan."
2,T4P0,No,0,SP2T4P006,0,The Museum,6,"Alan felt a ripple of cold pass through him as the officer continued speaking. The child, he clarified, had not actually been struck by the car. He had been seconds away from being hit when a passerby pulled him out of the vehicle’s path. That passerby was a young woman wearing a museum badge—the same badge Lina always kept pinned to her shirt. Alan turned to Lina slowly, and the shock on her face mirrored his own. Her outline seemed faint, almost translucent around the edges, as though she existed slightly apart from the world around her. Alan whispered that she had to return to her body, but Lina shook her head, saying she didn’t know how. Before either of them could speak again, soft tapping noises echoed through the hall—tiny footsteps, too light to belong to a person. Lina’s form flickered, dimmed, and vanished toward the museum’s front doors as though pulled by invisible threads. Alan rushed out after her, but by the time he reached the street, she was already gone. When he arrived at the hospital, a nurse informed him that Lina had woken up moments ago. She told him she remembered only fragments: a long hallway of moonlight, the porcelain dolls from the museum walking in solemn procession—and how they gently escorted her back into her own body. Then she frowned at Alan and added, almost annoyed:  “And one of them kept insisting I still hadn’t finished last week’s inventory report.”"